{
  "schema_version": "1.0",
  "skill_id": "bid-outline-planning",
  "project_id": "SIM-WB-20261011",
  "artifact_id": "ART-08-OUTLINE",
  "revision": 1,
  "created_at": "2026-10-10T23:15:21.925232+00:00",
  "status": "draft",
  "inputs": [
    {
      "artifact_id": "ART-01-NATIVE",
      "revision": 1,
      "relative_path": "artifacts/01-source-intake.json",
      "sha256": "e54a67dd19063b1f9e1345fa55cad3525f62891b1fc03b5645dc644b7852f464"
    },
    {
      "artifact_id": "ART-02-TENDER-ROUTING",
      "revision": 1,
      "relative_path": "artifacts/02-tender-routing.json",
      "sha256": "43009f353aa6b48ab2b7b9f5c59a5fe95257e82d2c09310f65dcba066adada67"
    }
  ],
  "summary": "按强制格式建立候选目录：六部分投标文件 + 技术服务方案 4.1/4.2/4.3；仅 4.1 进入候选正文写作，其余章节未创建正文。",
  "data": {
    "sections": [
      {
        "id": "SEC-1",
        "parent_id": null,
        "number": "1",
        "title": "投标函",
        "locked": true,
        "requirement_ids": [
          "REQ-SIGN-1"
        ],
        "scoring_ids": [],
        "compliance_ids": [
          "C-Q2",
          "C-FMT1"
        ],
        "format_ids": [
          "FMT-1",
          "FMT-2",
          "FMT-8"
        ],
        "task": "按原文格式填写投标函并完成签署盖章。",
        "evidence_needed": [
          "有效签署及盖章"
        ],
        "visuals_needed": []
      },
      {
        "id": "SEC-2",
        "parent_id": null,
        "number": "2",
        "title": "报价表",
        "locked": false,
        "requirement_ids": [],
        "scoring_ids": [
          "S1"
        ],
        "compliance_ids": [
          "C-FMT1"
        ],
        "format_ids": [
          "FMT-3"
        ],
        "task": "按原文口径填写报价，明确含税与币种。",
        "evidence_needed": [
          "本供应商报价"
        ],
        "visuals_needed": []
      },
      {
        "id": "SEC-3",
        "parent_id": null,
        "number": "3",
        "title": "资格证明",
        "locked": false,
        "requirement_ids": [
          "REQ-CERT-1"
        ],
        "scoring_ids": [],
        "compliance_ids": [
          "C-Q1",
          "C-Q3"
        ],
        "format_ids": [
          "FMT-4"
        ],
        "task": "提交有效营业执照复印件；不得提供虚假证明。",
        "evidence_needed": [
          "营业执照复印件"
        ],
        "visuals_needed": []
      },
      {
        "id": "SEC-4",
        "parent_id": null,
        "number": "4",
        "title": "技术服务方案",
        "locked": false,
        "requirement_ids": [
          "REQ-SCOPE-1",
          "REQ-PERIOD-1"
        ],
        "scoring_ids": [],
        "compliance_ids": [],
        "format_ids": [
          "FMT-5"
        ],
        "task": "按 4.1/4.2/4.3 三节编写技术服务方案。",
        "evidence_needed": [],
        "visuals_needed": []
      },
      {
        "id": "SEC-4-1",
        "parent_id": "SEC-4",
        "number": "4.1",
        "title": "事件闭环管理",
        "locked": false,
        "requirement_ids": [
          "REQ-R2",
          "REQ-R3",
          "REQ-R4"
        ],
        "scoring_ids": [
          "S2-1",
          "S2-2",
          "S2-3"
        ],
        "compliance_ids": [
          "C-R3"
        ],
        "format_ids": [],
        "task": "逐项描述登记/派发/接单/处置/复核/归档六个状态、复核退回机制、三类角色最小权限与 180 天审计日志，并配状态流转流程图。",
        "evidence_needed": [
          "六个状态逐项说明",
          "复核退回与日志说明",
          "角色权限矩阵"
        ],
        "visuals_needed": [
          "事件状态流转流程图（六状态含复核退回）",
          "事件处置界面设计示意"
        ]
      },
      {
        "id": "SEC-4-2",
        "parent_id": "SEC-4",
        "number": "4.2",
        "title": "集成与验收",
        "locked": false,
        "requirement_ids": [
          "REQ-R1",
          "REQ-R5"
        ],
        "scoring_ids": [
          "S3-1",
          "S3-2"
        ],
        "compliance_ids": [],
        "format_ids": [],
        "task": "描述既有告警平台接口映射，以及接口联调、状态流转、权限隔离、异常恢复四类测试与验收证据。",
        "evidence_needed": [
          "接口映射表",
          "四类测试用例与结果"
        ],
        "visuals_needed": [
          "集成与验收流程图"
        ]
      },
      {
        "id": "SEC-4-3",
        "parent_id": "SEC-4",
        "number": "4.3",
        "title": "服务保障",
        "locked": false,
        "requirement_ids": [
          "REQ-R6",
          "REQ-WARRANTY-1"
        ],
        "scoring_ids": [
          "S4-1",
          "S4-2"
        ],
        "compliance_ids": [],
        "format_ids": [],
        "task": "描述工作日服务、2 小时响应与 24 小时处置计划的资源依据，以及人员排班和培训安排。",
        "evidence_needed": [
          "响应流程与时限承诺",
          "人员排班表",
          "培训计划"
        ],
        "visuals_needed": [
          "服务响应流程图"
        ]
      },
      {
        "id": "SEC-5",
        "parent_id": null,
        "number": "5",
        "title": "逐项响应表",
        "locked": false,
        "requirement_ids": [],
        "scoring_ids": [],
        "compliance_ids": [
          "C-FMT1"
        ],
        "format_ids": [
          "FMT-6"
        ],
        "task": "逐条对应招标要求填写响应结论与偏离说明。",
        "evidence_needed": [],
        "visuals_needed": []
      },
      {
        "id": "SEC-6",
        "parent_id": null,
        "number": "6",
        "title": "业绩附件",
        "locked": false,
        "requirement_ids": [
          "REQ-PERF-1"
        ],
        "scoring_ids": [
          "S5"
        ],
        "compliance_ids": [
          "C-FMT1"
        ],
        "format_ids": [
          "FMT-7"
        ],
        "task": "附软件平台集成合同复印件及验收证明。",
        "evidence_needed": [
          "软件平台集成合同复印件",
          "验收证明"
        ],
        "visuals_needed": []
      }
    ],
    "unmapped_ids": []
  },
  "warnings": [
    "本目录是限定候选测试范围，不是完整编标；未经授权人确认前不得作为最终目录。"
  ],
  "blockers": [
    "未提供企业材料与报价，SEC-2/SEC-3/SEC-6 只能形成结构，无法形成可交付内容。"
  ]
}
